[
  {
    "displayName": "Gene",
    "description": "Gene expressed by hiPSCs",
    "tooltip": "Gene expressed by hiPSCs",
    "unit": "gene",
    "key": "Gene",
    "discrete": true,
    "options": {
      "0": {
        "color": "#fed98e",
        "name": "TUBA1B"
      },
      "1": {
        "color": "#7f48f3",
        "name": "SEC61B"
      },
      "2": {
        "color": "#838383",
        "name": "ACTB"
      },
      "3": {
        "color": "#fed98e",
        "name": "ST6GAL1"
      },
      "4": {
        "color": "#fed98e",
        "name": "TJP1"
      },
      "5": {
        "color": "#fed98e",
        "name": "MYH10"
      },
      "6": {
        "color": "#fed98e",
        "name": "LAMP1"
      }
    }
  },
  {
    "displayName": "Objective",
    "description": "Magnification of the Objective used to image cells",
    "tooltip": "Magnification of the Objective used to image cells",
    "unit": "magnification",
    "key": "Objective",
    "discrete": true,
    "options": {
      "0": {
        "color": "#fed98e",
        "name": "100"
      }
    }
  },
  {
    "displayName": "Structure",
    "description": "Cellular structure that was GFP tagged in imaged cells",
    "tooltip": "Cellular structure that was GFP tagged in imaged cells",
    "unit": "structure",
    "key": "Structure",
    "discrete": true,
    "options": {
      "0": {
        "color": "#fed98e",
        "name": "Microtubules"
      },
      "1": {
        "color": "#7f48f3",
        "name": "Endoplasmic reticulum"
      },
      "2": {
        "color": "#838383",
        "name": "Actin filaments"
      },
      "3": {
        "color": "#fed98e",
        "name": "Golgi"
      },
      "4": {
        "color": "#fed98e",
        "name": "Tight junctions"
      },
      "5": {
        "color": "#fed98e",
        "name": "Actomyosin bundles"
      },
      "6": {
        "color": "#fed98e",
        "name": "Lysosome"
      }
    }
  },
  {
    "displayName": "Protein",
    "description": "Protein that is expressed with GFP tag in imaged cells",
    "tooltip": "Protein that is expressed with GFP tag in imaged cells",
    "unit": "protein",
    "key": "Protein_Name",
    "discrete": true,
    "options": {
      "0": {
        "color": "#fed98e",
        "name": "Alpha-tubulin"
      },
      "1": {
        "color": "#7f48f3",
        "name": "Sec61 beta"
      },
      "2": {
        "color": "#838383",
        "name": "Beta-actin"
      },
      "3": {
        "color": "#fed98e",
        "name": "Sialyltransferase 1"
      },
      "4": {
        "color": "#fed98e",
        "name": "Tight junction protein ZO-1"
      },
      "5": {
        "color": "#fed98e",
        "name": "Non-muscle myosin heavy chain IIB"
      },
      "6": {
        "color": "#fed98e",
        "name": "LAMP-1"
      }
    }
  },
  {
    "displayName": "Drug Treatment Group",
    "description": "Are the imaged cells treated with drug or vehicle",
    "tooltip": "Are the imaged cells treated with drug or vehicle",
    "unit": "drug-or-vehicle",
    "key": "treatment_group",
    "discrete": true,
    "options": {
      "0": {
        "color": "#fed98e",
        "name": "Drug"
      },
      "1": {
        "color": "#7f48f3",
        "name": "Vehicle"
      }
    }
  },
  {
    "displayName": "Drug Time Point",
    "description": "How many hours after drug addition was imaging done",
    "tooltip": "How many hours after drug addition was imaging done",
    "unit": "hours",
    "key": "time_point",
    "discrete": true,
    "options": {
      "0": {
        "color": "#fed98e",
        "name": "0.5"
      },
      "1": {
        "color": "#7f48f3",
        "name": "1"
      },
      "2": {
        "color": "#7f48f3",
        "name": "2"
      },
      "3": {
        "color": "#7f48f3",
        "name": "24"
      }
    }
  },
  {
    "displayName": "Drug Concentration",
    "description": "Concentration of Drug added to imaged cells, in units of \u00b5M",
    "tooltip": "Concentration of Drug added to imaged cells, in units of \u00b5M",
    "unit": "\u00b5M",
    "key": "concentration",
    "discrete": false
  }
]